read,write,map,correspondences,1st_write,1st_same,1st_different,1st_same_len,1st_different_len,1st_congruency,most_congruency_write,most_congruency_same,most_congruency_different,most_congruency_same_len,most_congruency_different_len,most_congruency_congruency
a,['3'],䋪 啊娿婀屙疴锕阿𠥍𡹣𬮰,"[{'3': {'same': ['啊', '阿', '锕'], 'different': ['婀', '䋪', '娿', '屙', '疴', '𠥍', '𡹣', '𬮰']}}]",3,啊 阿 锕,婀 䋪 娿 屙 疴 𠥍 𡹣 𬮰,3,8,0.2727272727272727,3,啊 阿 锕,婀 䋪 娿 屙 疴 𠥍 𡹣 𬮰,3,8,0.2727272727272727
ai,['994'],𫣊 嗳嫒爱暧瑷𫉁𰾭叆,"[{'994': {'same': ['爱', '暧', '嗳', '𫣊', '嫒', '瑷', '𫉁', '𰾭', '叆'], 'different': []}}]",994,爱 暧 嗳 𫣊 嫒 瑷 𫉁 𰾭 叆,,9,0,1.0,994,爱 暧 嗳 𫣊 嫒 瑷 𫉁 𰾭 叆,,9,0,1.0
an,['995'],㝧 䀂䅁䢿侒咹姲安峖按晏案桉氨洝胺荌铵鞌鞍𱂨𫛩𡪙𦛅𧵨𨴣䯃,"[{'995': {'same': ['安', '案', '按', '胺', '氨', '鞍', '铵', '桉', '䀂', '䅁', '䢿', '侒', '峖', '洝', '荌', '鞌', '𡪙'], 'different': ['晏', '咹', '㝧', '姲', '𱂨', '𫛩', '𦛅', '𧵨', '𨴣', '䯃']}}]",995,安 案 按 胺 氨 鞍 铵 桉 䀂 䅁 䢿 侒 峖 洝 荌 鞌 𡪙,晏 咹 㝧 姲 𱂨 𫛩 𦛅 𧵨 𨴣 䯃,17,10,0.6296296296296297,995,安 案 按 胺 氨 鞍 铵 桉 䀂 䅁 䢿 侒 峖 洝 荌 鞌 𡪙,晏 咹 㝧 姲 𱂨 𫛩 𦛅 𧵨 𨴣 䯃,17,10,0.6296296296296297
ang,['1528'],㼜 㿮䇦䒋𱃵佒央姎岟怏抰映柍殃泱炴盎眏秧紻胦英𬨄𫓭雵鞅𩧫鸯𣃝𧲱𧵌𩲴𪎞𱌀𪚻,"[{'1528': {'same': ['盎', '㼜', '䇦'], 'different': ['英', '映', '央', '殃', '鸯', '秧', '怏', '泱', '㿮', '䒋', '𱃵', '佒', '姎', '岟', '抰', '柍', '炴', '眏', '紻', '胦', '𬨄', '𫓭', '雵', '鞅', '𩧫', '𣃝', '𧲱', '𧵌', '𩲴', '𪎞', '𱌀', '𪚻']}}]",1528,盎 㼜 䇦,英 映 央 殃 鸯 秧 怏 泱 㿮 䒋 𱃵 佒 姎 岟 抰 柍 炴 眏 紻 胦 𬨄 𫓭 雵 鞅 𩧫 𣃝 𧲱 𧵌 𩲴 𪎞 𱌀 𪚻,3,32,0.08571428571428572,1528,盎 㼜 䇦,英 映 央 殃 鸯 秧 怏 泱 㿮 䒋 𱃵 佒 姎 岟 抰 柍 炴 眏 紻 胦 𬨄 𫓭 雵 鞅 𩧫 𣃝 𧲱 𧵌 𩲴 𪎞 𱌀 𪚻,3,32,0.08571428571428572
ao,['966'],傲 厫嗷廒敖滶熬獒璈聱謷赘遨鏊骜鳌鼇𰾧,"[{'966': {'same': ['傲', '熬', '嗷', '敖', '遨', '獒', '鏊', '鳌', '骜', '厫', '廒', '滶', '璈', '聱', '謷', '鼇'], 'different': ['赘', '𰾧']}}]",966,傲 熬 嗷 敖 遨 獒 鏊 鳌 骜 厫 廒 滶 璈 聱 謷 鼇,赘 𰾧,16,2,0.8888888888888888,966,傲 熬 嗷 敖 遨 獒 鏊 鳌 骜 厫 廒 滶 璈 聱 謷 鼇,赘 𰾧,16,2,0.8888888888888888
ba,['996'],吧 巴帊弝把杷爬爸琶疤笆粑耙肥芭葩豝钯靶,"[{'996': {'same': ['吧', '把', '爸', '巴', '芭', '疤', '靶', '笆', '耙', '钯', '粑', '弝', '豝'], 'different': ['爬', '肥', '琶', '葩', '帊', '杷']}}]",996,吧 把 爸 巴 芭 疤 靶 笆 耙 钯 粑 弝 豝,爬 肥 琶 葩 帊 杷,13,6,0.6842105263157895,996,吧 把 爸 巴 芭 疤 靶 笆 耙 钯 粑 弝 豝,爬 肥 琶 葩 帊 杷,13,6,0.6842105263157895
bai,['1002'],㓦 㢶㪶㹮㼣佰咟帞弼栢洦瓸百皕粨絔袹貊銆陌𧻙𩢷,"[{'1002': {'same': ['百', '佰', '㓦', '栢', '瓸', '粨', '絔'], 'different': ['陌', '弼', '㢶', '㪶', '㹮', '㼣', '咟', '帞', '洦', '皕', '袹', '貊', '銆', '𧻙', '𩢷']}}]",1002,百 佰 㓦 栢 瓸 粨 絔,陌 弼 㢶 㪶 㹮 㼣 咟 帞 洦 皕 袹 貊 銆 𧻙 𩢷,7,15,0.3181818181818182,1002,百 佰 㓦 栢 瓸 粨 絔,陌 弼 㢶 㪶 㹮 㼣 咟 帞 洦 皕 袹 貊 銆 𧻙 𩢷,7,15,0.3181818181818182
ban,['1089'],㪵 䉽𱃷伴冸判半叛姅怑拌柈泮牉畔秚绊胖衅袢跘𰽰靽𬱙𦚓𧺾𨒃𩢔,"[{'1089': {'same': ['半', '伴', '绊', '拌', '㪵', '䉽', '𱃷', '姅', '怑', '柈', '秚', '𰽰', '靽', '𩢔'], 'different': ['判', '胖', '叛', '衅', '畔', '泮', '冸', '牉', '袢', '跘', '𬱙', '𦚓', '𧺾', '𨒃']}}]",1089,半 伴 绊 拌 㪵 䉽 𱃷 姅 怑 柈 秚 𰽰 靽 𩢔,判 胖 叛 衅 畔 泮 冸 牉 袢 跘 𬱙 𦚓 𧺾 𨒃,14,14,0.5,1089,半 伴 绊 拌 㪵 䉽 𱃷 姅 怑 柈 秚 𰽰 靽 𩢔,判 胖 叛 衅 畔 泮 冸 牉 袢 跘 𬱙 𦚓 𧺾 𨒃,14,14,0.5
bang,['1081'],㥬 㿶䄘䅭䒍䠙䧛䨦䩷傍嗙塝嫎嵭徬搒旁榜滂牓磅篣𫄰耪膀艕蒡螃覫谤镑𬴅髈鳑𠗵𢄎𢐊𣂆𣯊𣯟𤚰𤧭𤹔𥉣𥻭𦗍𧤞𨍩𨜷𨢐𩡕𪹚𫐼𫜡𬌿𬳣𭥁𮖧𮤂𰆊𱂜𱱼𲁙,"[{'1081': {'same': ['磅', '膀', '镑', '榜', '傍', '谤', '髈', '蒡', '㿶', '䧛', '䩷', '塝', '搒', '牓', '𫄰', '艕', '𢄎', '𤚰', '𨢐'], 'different': ['旁', '螃', '嗙', '滂', '㥬', '䄘', '䅭', '䒍', '䠙', '䨦', '嫎', '嵭', '徬', '篣', '耪', '覫', '𬴅', '鳑', '𠗵', '𢐊', '𣂆', '𣯊', '𣯟', '𤧭', '𤹔', '𥉣', '𥻭', '𦗍', '𧤞', '𨍩', '𨜷', '𩡕', '𪹚', '𫐼', '𫜡', '𬌿', '𬳣', '𭥁', '𮖧', '𮤂', '𰆊', '𱂜', '𱱼', '𲁙']}}]",1081,磅 膀 镑 榜 傍 谤 髈 蒡 㿶 䧛 䩷 塝 搒 牓 𫄰 艕 𢄎 𤚰 𨢐,旁 螃 嗙 滂 㥬 䄘 䅭 䒍 䠙 䨦 嫎 嵭 徬 篣 耪 覫 𬴅 鳑 𠗵 𢐊 𣂆 𣯊 𣯟 𤧭 𤹔 𥉣 𥻭 𦗍 𧤞 𨍩 𨜷 𩡕 𪹚 𫐼 𫜡 𬌿 𬳣 𭥁 𮖧 𮤂 𰆊 𱂜 𱱼 𲁙,19,44,0.30158730158730157,1081,磅 膀 镑 榜 傍 谤 髈 蒡 㿶 䧛 䩷 塝 搒 牓 𫄰 艕 𢄎 𤚰 𨢐,旁 螃 嗙 滂 㥬 䄘 䅭 䒍 䠙 䨦 嫎 嵭 徬 篣 耪 覫 𬴅 鳑 𠗵 𢐊 𣂆 𣯊 𣯟 𤧭 𤹔 𥉣 𥻭 𦗍 𧤞 𨍩 𨜷 𩡕 𪹚 𫐼 𫜡 𬌿 𬳣 𭥁 𮖧 𮤂 𰆊 𱂜 𱱼 𲁙,19,44,0.30158730158730157
bao,['1068'],㨐 㷛䭋䳰保堡媬椺湺煲緥葆褒褓襃賲𩭼,"[{'1068': {'same': ['保', '堡', '褒', '煲', '葆', '褓', '䭋', '䳰', '媬', '緥', '襃', '賲', '𩭼'], 'different': ['㨐', '㷛', '椺', '湺']}}]",1068,保 堡 褒 煲 葆 褓 䭋 䳰 媬 緥 襃 賲 𩭼,㨐 㷛 椺 湺,13,4,0.7647058823529411,1068,保 堡 褒 煲 葆 褓 䭋 䳰 媬 緥 襃 賲 𩭼,㨐 㷛 椺 湺,13,4,0.7647058823529411
bei,['1029'],㗗 㪏㼰㽡䇑䚜䠋𬨌𱂮䰦䱝𫜔俾卑啤埤婢崥庳捭朇椑渒焷牌猈琕痺睥碑禆稗箄粺𰬤聛脾萆蜱裨諀豍貏郫𰾎陴鞞髀鹎鼙𪐄,"[{'1029': {'same': ['卑', '碑', '㗗', '㽡', '椑', '鹎'], 'different': ['牌', '啤', '脾', '俾', '婢', '蜱', '稗', '裨', '陴', '㪏', '㼰', '䇑', '䚜', '䠋', '𬨌', '𱂮', '䰦', '䱝', '𫜔', '埤', '崥', '庳', '捭', '朇', '渒', '焷', '猈', '琕', '痺', '睥', '禆', '箄', '粺', '𰬤', '聛', '萆', '諀', '豍', '貏', '郫', '𰾎', '鞞', '髀', '鼙', '𪐄']}}]",1029,卑 碑 㗗 㽡 椑 鹎,牌 啤 脾 俾 婢 蜱 稗 裨 陴 㪏 㼰 䇑 䚜 䠋 𬨌 𱂮 䰦 䱝 𫜔 埤 崥 庳 捭 朇 渒 焷 猈 琕 痺 睥 禆 箄 粺 𰬤 聛 萆 諀 豍 貏 郫 𰾎 鞞 髀 鼙 𪐄,6,45,0.11764705882352941,1029,卑 碑 㗗 㽡 椑 鹎,牌 啤 脾 俾 婢 蜱 稗 裨 陴 㪏 㼰 䇑 䚜 䠋 𬨌 𱂮 䰦 䱝 𫜔 埤 崥 庳 捭 朇 渒 焷 猈 琕 痺 睥 禆 箄 粺 𰬤 聛 萆 諀 豍 貏 郫 𰾎 鞞 髀 鼙 𪐄,6,45,0.11764705882352941
ben,['1020'],㱵 𬏷䒈䩿䴅偾喷坟𪩸愤𰗺𬅫𣸣𰞻𰡞𫅗𪱥𰱟豮贲𮝷𫔁𱀡𱄀𬳟鲼𱋱𢊱𢴢𣯻𤖘𬓱𥳡𧷐,"[{'1020': {'same': ['贲', '𰡞', '𬓱'], 'different': ['喷', '愤', '坟', '㱵', '𬏷', '䒈', '䩿', '䴅', '偾', '𪩸', '𰗺', '𬅫', '𣸣', '𰞻', '𫅗', '𪱥', '𰱟', '豮', '𮝷', '𫔁', '𱀡', '𱄀', '𬳟', '鲼', '𱋱', '𢊱', '𢴢', '𣯻', '𤖘', '𥳡', '𧷐']}}]",1020,贲 𰡞 𬓱,喷 愤 坟 㱵 𬏷 䒈 䩿 䴅 偾 𪩸 𰗺 𬅫 𣸣 𰞻 𫅗 𪱥 𰱟 豮 𮝷 𫔁 𱀡 𱄀 𬳟 鲼 𱋱 𢊱 𢴢 𣯻 𤖘 𥳡 𧷐,3,31,0.08823529411764706,1020,贲 𰡞 𬓱,喷 愤 坟 㱵 𬏷 䒈 䩿 䴅 偾 𪩸 𰗺 𬅫 𣸣 𰞻 𫅗 𪱥 𰱟 豮 𮝷 𫔁 𱀡 𱄀 𬳟 鲼 𱋱 𢊱 𢴢 𣯻 𤖘 𥳡 𧷐,3,31,0.08823529411764706
beng,['1024'],㥊 䙀䨜倗堋奟崩弸掤朋棚淜焩痭硼稝绷萠𰺏𬭖鬅鹏𠜳𠡮𢉁𢽩𣂤𣨥𨂃𨹹𩋒,"[{'1024': {'same': ['崩', '绷', '䙀', '䨜', '奟', '痭', '𠜳', '𠡮', '𢉁', '𣂤', '𣨥', '𨹹'], 'different': ['朋', '棚', '鹏', '硼', '㥊', '倗', '堋', '弸', '掤', '淜', '焩', '稝', '萠', '𰺏', '𬭖', '鬅', '𢽩', '𨂃', '𩋒']}}]",1024,崩 绷 䙀 䨜 奟 痭 𠜳 𠡮 𢉁 𣂤 𣨥 𨹹,朋 棚 鹏 硼 㥊 倗 堋 弸 掤 淜 焩 稝 萠 𰺏 𬭖 鬅 𢽩 𨂃 𩋒,12,19,0.3870967741935484,1024,崩 绷 䙀 䨜 奟 痭 𠜳 𠡮 𢉁 𣂤 𣨥 𨹹,朋 棚 鹏 硼 㥊 倗 堋 弸 掤 淜 焩 稝 萠 𰺏 𬭖 鬅 𢽩 𨂃 𩋒,12,19,0.3870967741935484
bi,['1059'],㧙 䀣䏟䟤䩛𱂅𫠈佖咇妼宓必怭柲毖泌珌瑟祕秘苾袐𰴕邲铋𮤲𫗣馝𱅈𮭤𠚊𠛡𠨘𢁽𢗈𣁉𣢠𤵘𤽣𥁑𦣥𨒜𨠔𨤩𨸼𪏺,"[{'1059': {'same': ['必', '毖', '铋', '㧙', '䀣', '䟤', '䩛', '𱂅', '𫠈', '佖', '咇', '妼', '怭', '柲', '珌', '苾', '袐', '邲', '𮤲', '𫗣', '馝', '𱅈', '𠛡', '𠨘', '𢁽', '𣁉', '𣢠', '𤵘', '𨠔', '𨸼', '𪏺'], 'different': ['秘', '瑟', '泌', '䏟', '宓', '祕', '𰴕', '𮭤', '𠚊', '𢗈', '𤽣', '𥁑', '𦣥', '𨒜', '𨤩']}}]",1059,必 毖 铋 㧙 䀣 䟤 䩛 𱂅 𫠈 佖 咇 妼 怭 柲 珌 苾 袐 邲 𮤲 𫗣 馝 𱅈 𠛡 𠨘 𢁽 𣁉 𣢠 𤵘 𨠔 𨸼 𪏺,秘 瑟 泌 䏟 宓 祕 𰴕 𮭤 𠚊 𢗈 𤽣 𥁑 𦣥 𨒜 𨤩,31,15,0.6739130434782609,1059,必 毖 铋 㧙 䀣 䟤 䩛 𱂅 𫠈 佖 咇 妼 怭 柲 珌 苾 袐 邲 𮤲 𫗣 馝 𱅈 𠛡 𠨘 𢁽 𣁉 𣢠 𤵘 𨠔 𨸼 𪏺,秘 瑟 泌 䏟 宓 祕 𰴕 𮭤 𠚊 𢗈 𤽣 𥁑 𦣥 𨒜 𨤩,31,15,0.6739130434782609
bian,['1042'],㓲 㞈㲢㴜㻞㼐㾫𰬁䐔䡢䭏偏匾媥徧惼扁揙斒楄煸牑犏猵甂碥稨篇糄编翩艑萹蝙褊谝蹁遍鍽𱅝骗鳊𬸜𠋅𠪂𠷨𡎚𡺂𢉞𢐃𣩀𤬊𥚹𦑮𧡤𨲜𩩯𩴄𬸸𪏗𪖯𫕌𭨿𭶳𮸸𰀙𱖄𱜯,"[{'1042': {'same': ['遍', '编', '扁', '蝙', '煸', '匾', '㲢', '㴜', '䡢', '徧', '惼', '揙', '牑', '猵', '甂', '碥', '稨', '糄', '艑', '萹', '褊', '鍽', '鳊', '𠪂', '𣩀', '𩩯', '𬸸', '𪏗', '𪖯'], 'different': ['骗', '篇', '偏', '翩', '㓲', '㞈', '㻞', '㼐', '㾫', '𰬁', '䐔', '䭏', '媥', '斒', '楄', '犏', '谝', '蹁', '𱅝', '𬸜', '𠋅', '𠷨', '𡎚', '𡺂', '𢉞', '𢐃', '𤬊', '𥚹', '𦑮', '𧡤', '𨲜', '𩴄', '𫕌', '𭨿', '𭶳', '𮸸', '𰀙', '𱖄', '𱜯']}}]",1042,遍 编 扁 蝙 煸 匾 㲢 㴜 䡢 徧 惼 揙 牑 猵 甂 碥 稨 糄 艑 萹 褊 鍽 鳊 𠪂 𣩀 𩩯 𬸸 𪏗 𪖯,骗 篇 偏 翩 㓲 㞈 㻞 㼐 㾫 𰬁 䐔 䭏 媥 斒 楄 犏 谝 蹁 𱅝 𬸜 𠋅 𠷨 𡎚 𡺂 𢉞 𢐃 𤬊 𥚹 𦑮 𧡤 𨲜 𩴄 𫕌 𭨿 𭶳 𮸸 𰀙 𱖄 𱜯,29,39,0.4264705882352941,1042,遍 编 扁 蝙 煸 匾 㲢 㴜 䡢 徧 惼 揙 牑 猵 甂 碥 稨 糄 艑 萹 褊 鍽 鳊 𠪂 𣩀 𩩯 𬸸 𪏗 𪖯,骗 篇 偏 翩 㓲 㞈 㻞 㼐 㾫 𰬁 䐔 䭏 媥 斒 楄 犏 谝 蹁 𱅝 𬸜 𠋅 𠷨 𡎚 𡺂 𢉞 𢐃 𤬊 𥚹 𦑮 𧡤 𨲜 𩴄 𫕌 𭨿 𭶳 𮸸 𰀙 𱖄 𱜯,29,39,0.4264705882352941
biao,['1062'],㩠 𬴍儦瀌爊皫穮臕藨镳麃𡂘𡾌𥶔𦔩𩙒,"[{'1062': {'same': ['镳', '𬴍', '儦', '瀌', '穮', '臕', '藨', '麃', '𦔩'], 'different': ['㩠', '爊', '皫', '𡂘', '𡾌', '𥶔', '𩙒']}}]",1062,镳 𬴍 儦 瀌 穮 臕 藨 麃 𦔩,㩠 爊 皫 𡂘 𡾌 𥶔 𩙒,9,7,0.5625,1062,镳 𬴍 儦 瀌 穮 臕 藨 麃 𦔩,㩠 爊 皫 𡂘 𡾌 𥶔 𩙒,9,7,0.5625
bie,['1013'],别 币弊憋撆撇敝毙獘瞥蔽蹩鄨鳖𫜁𱌇𡚁𢠳,"[{'1013': {'same': ['别', '憋', '蹩', '鳖', '𱌇', '𢠳'], 'different': ['币', '毙', '弊', '蔽', '撇', '瞥', '敝', '撆', '獘', '鄨', '𫜁', '𡚁']}}]",1013,别 憋 蹩 鳖 𱌇 𢠳,币 毙 弊 蔽 撇 瞥 敝 撆 獘 鄨 𫜁 𡚁,6,12,0.3333333333333333,1013,别 憋 蹩 鳖 𱌇 𢠳,币 毙 弊 蔽 撇 瞥 敝 撆 獘 鄨 𫜁 𡚁,6,12,0.3333333333333333
bin,['1018'],㯽 傧嫔摈梹槟殡滨濵膑宾賔鬓𡣕𣩵𦆯𧓍𧸈𨮘𩪯𩯭,"[{'1018': {'same': ['宾', '槟', '滨', '殡', '鬓', '傧', '摈', '膑', '㯽', '梹', '濵', '賔', '𧸈'], 'different': ['嫔', '𡣕', '𣩵', '𦆯', '𧓍', '𨮘', '𩪯', '𩯭']}}]",1018,宾 槟 滨 殡 鬓 傧 摈 膑 㯽 梹 濵 賔 𧸈,嫔 𡣕 𣩵 𦆯 𧓍 𨮘 𩪯 𩯭,13,8,0.6190476190476191,1018,宾 槟 滨 殡 鬓 傧 摈 膑 㯽 梹 濵 賔 𧸈,嫔 𡣕 𣩵 𦆯 𧓍 𨮘 𩪯 𩯭,13,8,0.6190476190476191
bing,['1053'],㑂 㔷䇤𰬃丙怲抦昞昺柄氞炳病眪苪邴𰽥陃鞆𠒝𠛥𢨿𩬝,"[{'1053': {'same': ['病', '柄', '丙', '炳', '怲', '抦', '昞', '昺', '眪', '苪', '邴', '𰽥', '陃', '鞆', '𠒝', '𠛥', '𩬝'], 'different': ['㑂', '㔷', '䇤', '𰬃', '氞', '𢨿']}}]",1053,病 柄 丙 炳 怲 抦 昞 昺 眪 苪 邴 𰽥 陃 鞆 𠒝 𠛥 𩬝,㑂 㔷 䇤 𰬃 氞 𢨿,17,6,0.7391304347826086,1053,病 柄 丙 炳 怲 抦 昞 昺 眪 苪 邴 𰽥 陃 鞆 𠒝 𠛥 𩬝,㑂 㔷 䇤 𰬃 氞 𢨿,17,6,0.7391304347826086
bo,['381'],㗘 㙛㬍䍸䎔䗚䙏䪙䰊䶈傅博圑尃愽搏榑溥煿牔猼磗禣糐缚膊蒪赙镈馎髆𠣵𩹲,"[{'381': {'same': ['博', '搏', '膊', '㗘', '㬍', '䍸', '䗚', '䙏', '䰊', '䶈', '愽', '煿', '牔', '猼', '镈', '馎', '髆'], 'different': ['傅', '缚', '㙛', '䎔', '䪙', '圑', '尃', '榑', '溥', '磗', '禣', '糐', '蒪', '赙', '𠣵', '𩹲']}}]",381,博 搏 膊 㗘 㬍 䍸 䗚 䙏 䰊 䶈 愽 煿 牔 猼 镈 馎 髆,傅 缚 㙛 䎔 䪙 圑 尃 榑 溥 磗 禣 糐 蒪 赙 𠣵 𩹲,17,16,0.5151515151515151,381,博 搏 膊 㗘 㬍 䍸 䗚 䙏 䰊 䶈 愽 煿 牔 猼 镈 馎 髆,傅 缚 㙛 䎔 䪙 圑 尃 榑 溥 磗 禣 糐 蒪 赙 𠣵 𩹲,17,16,0.5151515151515151
bu,['386'],㕊 㭪䀯䊇䋠䝵䩉䪔䮒䯙乶俌匍哺喸圃埔尃峬庯悑捕敷旉晡浦烳甫痡盙秿簠脯舖舗莆补豧辅逋郙酺铺陠𫗦鬴𫚙𬷕𱋖黼𠜙𡜵𢼹𤗃𤙭𤿭𥪀𧻷𨁏𨴪𩊬𱂩𩳐,"[{'386': {'same': ['捕', '补', '埔', '哺', '晡', '逋', '䀯', '䊇', '䋠', '䝵', '䪔', '喸', '峬', '庯', '悑', '𫗦', '𬷕', '𠜙', '𥪀', '𧻷', '𨴪', '𩊬'], 'different': ['铺', '辅', '浦', '敷', '甫', '脯', '匍', '圃', '莆', '㕊', '㭪', '䩉', '䮒', '䯙', '乶', '俌', '尃', '旉', '烳', '痡', '盙', '秿', '簠', '舖', '舗', '豧', '郙', '酺', '陠', '鬴', '𫚙', '𱋖', '黼', '𡜵', '𢼹', '𤗃', '𤙭', '𤿭', '𨁏', '𱂩', '𩳐']}}]",386,捕 补 埔 哺 晡 逋 䀯 䊇 䋠 䝵 䪔 喸 峬 庯 悑 𫗦 𬷕 𠜙 𥪀 𧻷 𨴪 𩊬,铺 辅 浦 敷 甫 脯 匍 圃 莆 㕊 㭪 䩉 䮒 䯙 乶 俌 尃 旉 烳 痡 盙 秿 簠 舖 舗 豧 郙 酺 陠 鬴 𫚙 𱋖 黼 𡜵 𢼹 𤗃 𤙭 𤿭 𨁏 𱂩 𩳐,22,41,0.3492063492063492,386,捕 补 埔 哺 晡 逋 䀯 䊇 䋠 䝵 䪔 喸 峬 庯 悑 𫗦 𬷕 𠜙 𥪀 𧻷 𨴪 𩊬,铺 辅 浦 敷 甫 脯 匍 圃 莆 㕊 㭪 䩉 䮒 䯙 乶 俌 尃 旉 烳 痡 盙 秿 簠 舖 舗 豧 郙 酺 陠 鬴 𫚙 𱋖 黼 𡜵 𢼹 𤗃 𤙭 𤿭 𨁏 𱂩 𩳐,22,41,0.3492063492063492
ca,['45'],䕓 嚓察擦檫镲𢣼𥌀𧞍𨆾𩉐𩟔𩴳,"[{'45': {'same': ['擦', '嚓', '𨆾'], 'different': ['察', '檫', '䕓', '镲', '𢣼', '𥌀', '𧞍', '𩉐', '𩟔', '𩴳']}}]",45,擦 嚓 𨆾,察 檫 䕓 镲 𢣼 𥌀 𧞍 𩉐 𩟔 𩴳,3,10,0.23076923076923078,45,擦 嚓 𨆾,察 檫 䕓 镲 𢣼 𥌀 𧞍 𩉐 𩟔 𩴳,3,10,0.23076923076923078
cai,['245'],㥒 䌽䐆䣋䰂倸啋采婇寀彩棌睬菜踩釆𠗡𡸯𣈄𣶶𤊕𤚀𤟖𤷕𥚖𥟩𦖗𧳥𨨫𨺉𩓰𩜓𫆇𫽱𬎱,"[{'245': {'same': ['菜', '彩', '采', '踩', '睬', '㥒', '䌽', '䐆', '䣋', '䰂', '倸', '啋', '婇', '寀', '棌', '𤚀', '𤟖', '𤷕'], 'different': ['釆', '𠗡', '𡸯', '𣈄', '𣶶', '𤊕', '𥚖', '𥟩', '𦖗', '𧳥', '𨨫', '𨺉', '𩓰', '𩜓', '𫆇', '𫽱', '𬎱']}}]",245,菜 彩 采 踩 睬 㥒 䌽 䐆 䣋 䰂 倸 啋 婇 寀 棌 𤚀 𤟖 𤷕,釆 𠗡 𡸯 𣈄 𣶶 𤊕 𥚖 𥟩 𦖗 𧳥 𨨫 𨺉 𩓰 𩜓 𫆇 𫽱 𬎱,18,17,0.5142857142857142,245,菜 彩 采 踩 睬 㥒 䌽 䐆 䣋 䰂 倸 啋 婇 寀 棌 𤚀 𤟖 𤷕,釆 𠗡 𡸯 𣈄 𣶶 𤊕 𥚖 𥟩 𦖗 𧳥 𨨫 𨺉 𩓰 𩜓 𫆇 𫽱 𬎱,18,17,0.5142857142857142
can,['23'],𡞋 㟥𫶅㡎𬌷㽩䅟𫎺𬱬𫢺剼参叅𰇼𫮅惨掺椮毵毶渗犙瘆碜𥮾糁𰬪蔘𰴂𬢳贂遪𮠳𬭝骖𩭹鯵鲹黪𠔭𰄁𠫭𠬊𢕕𢿈𣪶𰞷𤗲𤨵𥊀𦌀𦲞𧑁𧗋𨝐𨨕𫕨𩈼𩌰𩞀𩫦𩴑𪅩𫃰𫤯𬛓𬤄𬥞𬯊𬳯𮜒𰄶𰸙𰿕𱐠𱝦𱝳𱭞𱯆𱻣,"[{'23': {'same': ['参', '惨', '叅', '𡞋', '㽩', '䅟', '𫎺', '𫢺', '𥮾', '𬢳', '骖', '黪', '𠫭', '𩈼', '𬤄'], 'different': ['掺', '渗', '瘆', '碜', '糁', '鲹', '㟥', '𫶅', '㡎', '𬌷', '𬱬', '剼', '𰇼', '𫮅', '椮', '毵', '毶', '犙', '𰬪', '蔘', '𰴂', '贂', '遪', '𮠳', '𬭝', '𩭹', '鯵', '𠔭', '𰄁', '𠬊', '𢕕', '𢿈', '𣪶', '𰞷', '𤗲', '𤨵', '𥊀', '𦌀', '𦲞', '𧑁', '𧗋', '𨝐', '𨨕', '𫕨', '𩌰', '𩞀', '𩫦', '𩴑', '𪅩', '𫃰', '𫤯', '𬛓', '𬥞', '𬯊', '𬳯', '𮜒', '𰄶', '𰸙', '𰿕', '𱐠', '𱝦', '𱝳', '𱭞', '𱯆', '𱻣']}}]",23,参 惨 叅 𡞋 㽩 䅟 𫎺 𫢺 𥮾 𬢳 骖 黪 𠫭 𩈼 𬤄,掺 渗 瘆 碜 糁 鲹 㟥 𫶅 㡎 𬌷 𬱬 剼 𰇼 𫮅 椮 毵 毶 犙 𰬪 蔘 𰴂 贂 遪 𮠳 𬭝 𩭹 鯵 𠔭 𰄁 𠬊 𢕕 𢿈 𣪶 𰞷 𤗲 𤨵 𥊀 𦌀 𦲞 𧑁 𧗋 𨝐 𨨕 𫕨 𩌰 𩞀 𩫦 𩴑 𪅩 𫃰 𫤯 𬛓 𬥞 𬯊 𬳯 𮜒 𰄶 𰸙 𰿕 𱐠 𱝦 𱝳 𱭞 𱯆 𱻣,15,65,0.1875,23,参 惨 叅 𡞋 㽩 䅟 𫎺 𫢺 𥮾 𬢳 骖 黪 𠫭 𩈼 𬤄,掺 渗 瘆 碜 糁 鲹 㟥 𫶅 㡎 𬌷 𬱬 剼 𰇼 𫮅 椮 毵 毶 犙 𰬪 蔘 𰴂 贂 遪 𮠳 𬭝 𩭹 鯵 𠔭 𰄁 𠬊 𢕕 𢿈 𣪶 𰞷 𤗲 𤨵 𥊀 𦌀 𦲞 𧑁 𧗋 𨝐 𨨕 𫕨 𩌰 𩞀 𩫦 𩴑 𪅩 𫃰 𫤯 𬛓 𬥞 𬯊 𬳯 𮜒 𰄶 𰸙 𰿕 𱐠 𱝦 𱝳 𱭞 𱯆 𱻣,15,65,0.1875
cang,['254'],䅮 䢢𮠞䲝仓伧𰃷刅创呛嵢怆戗抢枪沧炝牄𪺷玱疮篬舱苍螥謒𬥳跄𬬰鸧𠑐𠥐𣯙𤚬𤾙𥎄𥏲𥻲𦃹𬁸𧽜𨜾𨶆𩀞𩝞𩮩𪙎𪤇𪦔𪰻𫀞𬔎𬚤𬡧𰧕𱏗𱝷𱭟𲉝𲊶,"[{'254': {'same': ['仓', '舱', '苍', '沧', '䅮', '䢢', '伧', '𰃷', '嵢', '𪺷', '螥', '鸧', '𠥐', '𤚬', '𩀞', '𩝞'], 'different': ['枪', '抢', '创', '呛', '疮', '跄', '怆', '戗', '𮠞', '䲝', '刅', '炝', '牄', '玱', '篬', '謒', '𬥳', '𬬰', '𠑐', '𣯙', '𤾙', '𥎄', '𥏲', '𥻲', '𦃹', '𬁸', '𧽜', '𨜾', '𨶆', '𩮩', '𪙎', '𪤇', '𪦔', '𪰻', '𫀞', '𬔎', '𬚤', '𬡧', '𰧕', '𱏗', '𱝷', '𱭟', '𲉝', '𲊶']}}]",254,仓 舱 苍 沧 䅮 䢢 伧 𰃷 嵢 𪺷 螥 鸧 𠥐 𤚬 𩀞 𩝞,枪 抢 创 呛 疮 跄 怆 戗 𮠞 䲝 刅 炝 牄 玱 篬 謒 𬥳 𬬰 𠑐 𣯙 𤾙 𥎄 𥏲 𥻲 𦃹 𬁸 𧽜 𨜾 𨶆 𩮩 𪙎 𪤇 𪦔 𪰻 𫀞 𬔎 𬚤 𬡧 𰧕 𱏗 𱝷 𱭟 𲉝 𲊶,16,44,0.26666666666666666,254,仓 舱 苍 沧 䅮 䢢 伧 𰃷 嵢 𪺷 螥 鸧 𠥐 𤚬 𩀞 𩝞,枪 抢 创 呛 疮 跄 怆 戗 𮠞 䲝 刅 炝 牄 玱 篬 謒 𬥳 𬬰 𠑐 𣯙 𤾙 𥎄 𥏲 𥻲 𦃹 𬁸 𧽜 𨜾 𨶆 𩮩 𪙎 𪤇 𪦔 𪰻 𫀞 𬔎 𬚤 𬡧 𰧕 𱏗 𱝷 𱭟 𲉝 𲊶,16,44,0.26666666666666666
cao,['231'],䜊 嘈曹槽漕糟螬蹧遭𫚧𡮦,"[{'231': {'same': ['槽', '曹', '嘈', '漕', '螬', '𡮦'], 'different': ['糟', '遭', '䜊', '蹧', '𫚧']}}]",231,槽 曹 嘈 漕 螬 𡮦,糟 遭 䜊 蹧 𫚧,6,5,0.5454545454545454,231,槽 曹 嘈 漕 螬 𡮦,糟 遭 䜊 蹧 𫚧,6,5,0.5454545454545454
ce,['57'],䈟 䶡侧则厕𰎖恻测荝铡鲗𰇘𡬂𫼤𥠉,"[{'57': {'same': ['测', '侧', '厕', '恻', '䈟', '荝', '𥠉'], 'different': ['则', '铡', '䶡', '𰎖', '鲗', '𰇘', '𡬂', '𫼤']}}]",57,测 侧 厕 恻 䈟 荝 𥠉,则 铡 䶡 𰎖 鲗 𰇘 𡬂 𫼤,7,8,0.4666666666666667,57,测 侧 厕 恻 䈟 荝 𥠉,则 铡 䶡 𰎖 鲗 𰇘 𡬂 𫼤,7,8,0.4666666666666667
cen,['23'],𡞋 㟥𫶅㡎𬌷㽩䅟𫎺𬱬𫢺剼参叅𰇼𫮅惨掺椮毵毶渗犙瘆碜𥮾糁𰬪蔘𰴂𬢳贂遪𮠳𬭝骖𩭹鯵鲹黪𠔭𰄁𠫭𠬊𢕕𢿈𣪶𰞷𤗲𤨵𥊀𦌀𦲞𧑁𧗋𨝐𨨕𫕨𩈼𩌰𩞀𩫦𩴑𪅩𫃰𫤯𬛓𬤄𬥞𬯊𬳯𮜒𰄶𰸙𰿕𱐠𱝦𱝳𱭞𱯆𱻣,"[{'23': {'same': ['㟥'], 'different': ['参', '惨', '掺', '渗', '瘆', '碜', '叅', '糁', '鲹', '𡞋', '𫶅', '㡎', '𬌷', '㽩', '䅟', '𫎺', '𬱬', '𫢺', '剼', '𰇼', '𫮅', '椮', '毵', '毶', '犙', '𥮾', '𰬪', '蔘', '𰴂', '𬢳', '贂', '遪', '𮠳', '𬭝', '骖', '𩭹', '鯵', '黪', '𠔭', '𰄁', '𠫭', '𠬊', '𢕕', '𢿈', '𣪶', '𰞷', '𤗲', '𤨵', '𥊀', '𦌀', '𦲞', '𧑁', '𧗋', '𨝐', '𨨕', '𫕨', '𩈼', '𩌰', '𩞀', '𩫦', '𩴑', '𪅩', '𫃰', '𫤯', '𬛓', '𬤄', '𬥞', '𬯊', '𬳯', '𮜒', '𰄶', '𰸙', '𰿕', '𱐠', '𱝦', '𱝳', '𱭞', '𱯆', '𱻣']}}]",23,㟥,参 惨 掺 渗 瘆 碜 叅 糁 鲹 𡞋 𫶅 㡎 𬌷 㽩 䅟 𫎺 𬱬 𫢺 剼 𰇼 𫮅 椮 毵 毶 犙 𥮾 𰬪 蔘 𰴂 𬢳 贂 遪 𮠳 𬭝 骖 𩭹 鯵 黪 𠔭 𰄁 𠫭 𠬊 𢕕 𢿈 𣪶 𰞷 𤗲 𤨵 𥊀 𦌀 𦲞 𧑁 𧗋 𨝐 𨨕 𫕨 𩈼 𩌰 𩞀 𩫦 𩴑 𪅩 𫃰 𫤯 𬛓 𬤄 𬥞 𬯊 𬳯 𮜒 𰄶 𰸙 𰿕 𱐠 𱝦 𱝳 𱭞 𱯆 𱻣,1,79,0.0125,23,㟥,参 惨 掺 渗 瘆 碜 叅 糁 鲹 𡞋 𫶅 㡎 𬌷 㽩 䅟 𫎺 𬱬 𫢺 剼 𰇼 𫮅 椮 毵 毶 犙 𥮾 𰬪 蔘 𰴂 𬢳 贂 遪 𮠳 𬭝 骖 𩭹 鯵 黪 𠔭 𰄁 𠫭 𠬊 𢕕 𢿈 𣪶 𰞷 𤗲 𤨵 𥊀 𦌀 𦲞 𧑁 𧗋 𨝐 𨨕 𫕨 𩈼 𩌰 𩞀 𩫦 𩴑 𪅩 𫃰 𫤯 𬛓 𬤄 𬥞 𬯊 𬳯 𮜒 𰄶 𰸙 𰿕 𱐠 𱝦 𱝳 𱭞 𱯆 𱻣,1,79,0.0125
ceng,['68'],㣒 䒏僧噌增层嶒憎曾橧甑矰缯罾赠蹭鄫,"[{'68': {'same': ['曾', '层', '蹭', '噌', '㣒', '嶒'], 'different': ['增', '赠', '憎', '僧', '甑', '缯', '䒏', '橧', '矰', '罾', '鄫']}}]",68,曾 层 蹭 噌 㣒 嶒,增 赠 憎 僧 甑 缯 䒏 橧 矰 罾 鄫,6,11,0.35294117647058826,68,曾 层 蹭 噌 㣒 嶒,增 赠 憎 僧 甑 缯 䒏 橧 矰 罾 鄫,6,11,0.35294117647058826
cha,['41'],㞚 㢎㮑㴙䅤䙄䮢偛喢插揷敮歃臿锸𠝞𢔣𢩖𢻗𣖄𥀈𥈊𥪵𥯥𦂉𦝥𦥛𦦕𦦘𦦱𧶵𨂵𩃹𪘾,"[{'41': {'same': ['插', '㮑', '偛', '揷', '臿', '锸', '𠝞', '𢔣', '𦝥', '𦦘', '𦦱', '𧶵', '𪘾'], 'different': ['歃', '㞚', '㢎', '㴙', '䅤', '䙄', '䮢', '喢', '敮', '𢩖', '𢻗', '𣖄', '𥀈', '𥈊', '𥪵', '𥯥', '𦂉', '𦥛', '𦦕', '𨂵', '𩃹']}}]",41,插 㮑 偛 揷 臿 锸 𠝞 𢔣 𦝥 𦦘 𦦱 𧶵 𪘾,歃 㞚 㢎 㴙 䅤 䙄 䮢 喢 敮 𢩖 𢻗 𣖄 𥀈 𥈊 𥪵 𥯥 𦂉 𦥛 𦦕 𨂵 𩃹,13,21,0.38235294117647056,41,插 㮑 偛 揷 臿 锸 𠝞 𢔣 𦝥 𦦘 𦦱 𧶵 𪘾,歃 㞚 㢎 㴙 䅤 䙄 䮢 喢 敮 𢩖 𢻗 𣖄 𥀈 𥈊 𥪵 𥯥 𦂉 𦥛 𦦕 𨂵 𩃹,13,21,0.38235294117647056
chai,['12'],㞉 㷢㿷䁟䐤䑘䡨䰈䴾傞嗟嵯嵳差搓槎溠瑳瘥磋𬘷艖蒫褨蹉醝𫟿髊鹾𬺎𣍏𣩈,"[{'12': {'same': ['䐤', '瘥'], 'different': ['差', '搓', '磋', '鹾', '嗟', '蹉', '㞉', '㷢', '㿷', '䁟', '䑘', '䡨', '䰈', '䴾', '傞', '嵯', '嵳', '槎', '溠', '瑳', '𬘷', '艖', '蒫', '褨', '醝', '𫟿', '髊', '𬺎', '𣍏', '𣩈']}}]",12,䐤 瘥,差 搓 磋 鹾 嗟 蹉 㞉 㷢 㿷 䁟 䑘 䡨 䰈 䴾 傞 嵯 嵳 槎 溠 瑳 𬘷 艖 蒫 褨 醝 𫟿 髊 𬺎 𣍏 𣩈,2,30,0.0625,12,䐤 瘥,差 搓 磋 鹾 嗟 蹉 㞉 㷢 㿷 䁟 䑘 䡨 䰈 䴾 傞 嵯 嵳 槎 溠 瑳 𬘷 艖 蒫 褨 醝 𫟿 髊 𬺎 𣍏 𣩈,2,30,0.0625
chan,['24'],㜶 㸥㺥䂁䧯䪌儳劖嚵巉才搀欃𫥎瀺艬谗酁镵馋𠋂𠣄𡅛𰊅𡮿𡺎𢖞𢥋𢩢𣤱𤒰𤜇𤮭𦂯𦧻𧕃𧥓𨇩𨳂𩖌𩝎𩰃𩺒𩽝𪓄𪗂𪚃𪶳𫙭𰧫𰸤𰾠𲁰,"[{'24': {'same': ['搀', '馋', '谗', '㸥', '㺥', '䂁', '䧯', '儳', '劖', '嚵', '巉', '欃', '瀺', '艬', '酁', '镵', '𠣄', '𡮿', '𢥋', '𣤱', '𤮭', '𧕃', '𧥓', '𨳂', '𩖌', '𩽝', '𪓄', '𪗂', '𪚃'], 'different': ['才', '㜶', '䪌', '𫥎', '𠋂', '𡅛', '𰊅', '𡺎', '𢖞', '𢩢', '𤒰', '𤜇', '𦂯', '𦧻', '𨇩', '𩝎', '𩰃', '𩺒', '𪶳', '𫙭', '𰧫', '𰸤', '𰾠', '𲁰']}}]",24,搀 馋 谗 㸥 㺥 䂁 䧯 儳 劖 嚵 巉 欃 瀺 艬 酁 镵 𠣄 𡮿 𢥋 𣤱 𤮭 𧕃 𧥓 𨳂 𩖌 𩽝 𪓄 𪗂 𪚃,才 㜶 䪌 𫥎 𠋂 𡅛 𰊅 𡺎 𢖞 𢩢 𤒰 𤜇 𦂯 𦧻 𨇩 𩝎 𩰃 𩺒 𪶳 𫙭 𰧫 𰸤 𰾠 𲁰,29,24,0.5471698113207547,24,搀 馋 谗 㸥 㺥 䂁 䧯 儳 劖 嚵 巉 欃 瀺 艬 酁 镵 𠣄 𡮿 𢥋 𣤱 𤮭 𧕃 𧥓 𨳂 𩖌 𩽝 𪓄 𪗂 𪚃,才 㜶 䪌 𫥎 𠋂 𡅛 𰊅 𡺎 𢖞 𢩢 𤒰 𤜇 𦂯 𦧻 𨇩 𩝎 𩰃 𩺒 𪶳 𫙭 𰧫 𰸤 𰾠 𲁰,29,24,0.5471698113207547
chang,['119'],㫀 䅛䗉䞎䮖倡唱娼昌晿椙淐焻猖琩菖裮誯锠阊鲳𪂇𬸶,"[{'119': {'same': ['唱', '昌', '娼', '倡', '猖', '鲳', '䅛', '䗉', '䮖', '晿', '椙', '淐', '焻', '琩', '菖', '裮', '誯', '锠', '阊', '𪂇', '𬸶'], 'different': ['㫀', '䞎']}}]",119,唱 昌 娼 倡 猖 鲳 䅛 䗉 䮖 晿 椙 淐 焻 琩 菖 裮 誯 锠 阊 𪂇 𬸶,㫀 䞎,21,2,0.9130434782608695,119,唱 昌 娼 倡 猖 鲳 䅛 䗉 䮖 晿 椙 淐 焻 琩 菖 裮 誯 锠 阊 𪂇 𬸶,㫀 䞎,21,2,0.9130434782608695
