read,write,map,correspondences,1st_write,1st_same,1st_different,1st_same_len,1st_different_len,1st_congruency,most_congruency_write,most_congruency_same,most_congruency_different,most_congruency_same_len,most_congruency_different_len,most_congruency_congruency
shao,['220'],㲖 㲵䇌䏴䘯䨭䴛俏削哨娋宵屑峭帩弰悄捎旓梢消焇琑痟睄矟硝稍筲绡肖艄莦蛸诮赵踃輎逍销陗霄鞘𱂉颵髾魈𱇯𡌔𧺉,"[{'220': {'same': ['稍', '哨', '捎', '梢', '筲', '艄', '䏴', '娋', '弰', '旓', '睄', '莦', '蛸', '輎', '颵', '髾', '𱇯'], 'different': ['消', '销', '肖', '悄', '削', '宵', '屑', '俏', '逍', '硝', '赵', '霄', '鞘', '峭', '㲖', '㲵', '䇌', '䘯', '䨭', '䴛', '帩', '焇', '琑', '痟', '矟', '绡', '诮', '踃', '陗', '𱂉', '魈', '𡌔', '𧺉']}}]",220,稍 哨 捎 梢 筲 艄 䏴 娋 弰 旓 睄 莦 蛸 輎 颵 髾 𱇯,消 销 肖 悄 削 宵 屑 俏 逍 硝 赵 霄 鞘 峭 㲖 㲵 䇌 䘯 䨭 䴛 帩 焇 琑 痟 矟 绡 诮 踃 陗 𱂉 魈 𡌔 𧺉,17,33,0.34,220,稍 哨 捎 梢 筲 艄 䏴 娋 弰 旓 睄 莦 蛸 輎 颵 髾 𱇯,消 销 肖 悄 削 宵 屑 俏 逍 硝 赵 霄 鞘 峭 㲖 㲵 䇌 䘯 䨭 䴛 帩 焇 琑 痟 矟 绡 诮 踃 陗 𱂉 魈 𡌔 𧺉,17,33,0.34
she,['979'],嗫 慑摄𪳍聂𫌇𰵹蹑镊颞,"[{'979': {'same': ['摄', '慑', '𪳍'], 'different': ['颞', '聂', '镊', '蹑', '嗫', '𫌇', '𰵹']}}]",979,摄 慑 𪳍,颞 聂 镊 蹑 嗫 𫌇 𰵹,3,7,0.3,979,摄 慑 𪳍,颞 聂 镊 蹑 嗫 𫌇 𰵹,3,7,0.3
shei,['285'],䳡 准售唯堆奋崔巂帷惟推椎淮焦睢瞿碓稚维萑虽蜼谁趡进锥隹隺隼隽雔鞋骓魋𱊅𦼉𨿽𩋔,"[{'285': {'same': ['谁'], 'different': ['进', '准', '唯', '维', '推', '鞋', '虽', '堆', '奋', '售', '焦', '崔', '稚', '椎', '惟', '锥', '帷', '隼', '隽', '瞿', '淮', '骓', '碓', '䳡', '巂', '睢', '萑', '蜼', '趡', '隹', '隺', '雔', '魋', '𱊅', '𦼉', '𨿽', '𩋔']}}]",285,谁,进 准 唯 维 推 鞋 虽 堆 奋 售 焦 崔 稚 椎 惟 锥 帷 隼 隽 瞿 淮 骓 碓 䳡 巂 睢 萑 蜼 趡 隹 隺 雔 魋 𱊅 𦼉 𨿽 𩋔,1,37,0.02631578947368421,285,谁,进 准 唯 维 推 鞋 虽 堆 奋 售 焦 崔 稚 椎 惟 锥 帷 隼 隽 瞿 淮 骓 碓 䳡 巂 睢 萑 蜼 趡 隹 隺 雔 魋 𱊅 𦼉 𨿽 𩋔,1,37,0.02631578947368421
shen,['23'],𡞋 㟥𫶅㡎𬌷㽩䅟𫎺𬱬𫢺剼参叅𰇼𫮅惨掺椮毵毶渗犙瘆碜𥮾糁𰬪蔘𰴂𬢳贂遪𮠳𬭝骖𩭹鯵鲹黪𠔭𰄁𠫭𠬊𢕕𢿈𣪶𰞷𤗲𤨵𥊀𦌀𦲞𧑁𧗋𨝐𨨕𫕨𩈼𩌰𩞀𩫦𩴑𪅩𫃰𫤯𬛓𬤄𬥞𬯊𬳯𮜒𰄶𰸙𰿕𱐠𱝦𱝳𱭞𱯆𱻣,"[{'23': {'same': ['渗', '瘆', '鲹', '蔘', '鯵', '𰄁', '𦌀', '𨝐'], 'different': ['参', '惨', '掺', '碜', '叅', '糁', '𡞋', '㟥', '𫶅', '㡎', '𬌷', '㽩', '䅟', '𫎺', '𬱬', '𫢺', '剼', '𰇼', '𫮅', '椮', '毵', '毶', '犙', '𥮾', '𰬪', '𰴂', '𬢳', '贂', '遪', '𮠳', '𬭝', '骖', '𩭹', '黪', '𠔭', '𠫭', '𠬊', '𢕕', '𢿈', '𣪶', '𰞷', '𤗲', '𤨵', '𥊀', '𦲞', '𧑁', '𧗋', '𨨕', '𫕨', '𩈼', '𩌰', '𩞀', '𩫦', '𩴑', '𪅩', '𫃰', '𫤯', '𬛓', '𬤄', '𬥞', '𬯊', '𬳯', '𮜒', '𰄶', '𰸙', '𰿕', '𱐠', '𱝦', '𱝳', '𱭞', '𱯆', '𱻣']}}]",23,渗 瘆 鲹 蔘 鯵 𰄁 𦌀 𨝐,参 惨 掺 碜 叅 糁 𡞋 㟥 𫶅 㡎 𬌷 㽩 䅟 𫎺 𬱬 𫢺 剼 𰇼 𫮅 椮 毵 毶 犙 𥮾 𰬪 𰴂 𬢳 贂 遪 𮠳 𬭝 骖 𩭹 黪 𠔭 𠫭 𠬊 𢕕 𢿈 𣪶 𰞷 𤗲 𤨵 𥊀 𦲞 𧑁 𧗋 𨨕 𫕨 𩈼 𩌰 𩞀 𩫦 𩴑 𪅩 𫃰 𫤯 𬛓 𬤄 𬥞 𬯊 𬳯 𮜒 𰄶 𰸙 𰿕 𱐠 𱝦 𱝳 𱭞 𱯆 𱻣,8,72,0.1,23,渗 瘆 鲹 蔘 鯵 𰄁 𦌀 𨝐,参 惨 掺 碜 叅 糁 𡞋 㟥 𫶅 㡎 𬌷 㽩 䅟 𫎺 𬱬 𫢺 剼 𰇼 𫮅 椮 毵 毶 犙 𥮾 𰬪 𰴂 𬢳 贂 遪 𮠳 𬭝 骖 𩭹 黪 𠔭 𠫭 𠬊 𢕕 𢿈 𣪶 𰞷 𤗲 𤨵 𥊀 𦲞 𧑁 𧗋 𨨕 𫕨 𩈼 𩌰 𩞀 𩫦 𩴑 𪅩 𫃰 𫤯 𬛓 𬤄 𬥞 𬯊 𬳯 𮜒 𰄶 𰸙 𰿕 𱐠 𱝦 𱝳 𱭞 𱯆 𱻣,8,72,0.1
sheng,['1130'],𬸆 䴤姓徃性旌星栍殅泩牲狌珄生甡产甥甦省眚笙素胜苼貹𰽫青鼪𠇷𡉄𣢡𣬺𤯡𤯥,"[{'1130': {'same': ['生', '胜', '省', '牲', '甥', '笙', '𬸆', '䴤', '栍', '殅', '泩', '狌', '珄', '眚', '苼', '貹', '𰽫', '鼪', '𠇷', '𣢡', '𣬺', '𤯡'], 'different': ['性', '星', '产', '素', '青', '姓', '旌', '徃', '甡', '甦', '𡉄', '𤯥']}}]",1130,生 胜 省 牲 甥 笙 𬸆 䴤 栍 殅 泩 狌 珄 眚 苼 貹 𰽫 鼪 𠇷 𣢡 𣬺 𤯡,性 星 产 素 青 姓 旌 徃 甡 甦 𡉄 𤯥,22,12,0.6470588235294118,1130,生 胜 省 牲 甥 笙 𬸆 䴤 栍 殅 泩 狌 珄 眚 苼 貹 𰽫 鼪 𠇷 𣢡 𣬺 𤯡,性 星 产 素 青 姓 旌 徃 甡 甦 𡉄 𤯥,22,12,0.6470588235294118
shi,['1193'],侙 式弑恜拭栻烒试轼𫟸𢂑𢎎𥅞𥿮𧵻𩗎𪉅,"[{'1193': {'same': ['试', '式', '拭', '弑', '轼', '栻', '烒', '𫟸', '𢂑', '𥅞', '𩗎'], 'different': ['侙', '恜', '𢎎', '𥿮', '𧵻', '𪉅']}}]",1193,试 式 拭 弑 轼 栻 烒 𫟸 𢂑 𥅞 𩗎,侙 恜 𢎎 𥿮 𧵻 𪉅,11,6,0.6470588235294118,1193,试 式 拭 弑 轼 栻 烒 𫟸 𢂑 𥅞 𩗎,侙 恜 𢎎 𥿮 𧵻 𪉅,11,6,0.6470588235294118
shou,['1144'],䭫 𬱯䭮渞艏衜道首𠃺𨲛𩠑𩠦𩠯𩠶𩠹,"[{'1144': {'same': ['首', '𬱯', '艏', '𩠶'], 'different': ['道', '䭫', '䭮', '渞', '衜', '𠃺', '𨲛', '𩠑', '𩠦', '𩠯', '𩠹']}}]",1144,首 𬱯 艏 𩠶,道 䭫 䭮 渞 衜 𠃺 𨲛 𩠑 𩠦 𩠯 𩠹,4,11,0.26666666666666666,1144,首 𬱯 艏 𩠶,道 䭫 䭮 渞 衜 𠃺 𨲛 𩠑 𩠦 𩠯 𩠹,4,11,0.26666666666666666
shu,['1611'],㓱 㡏㢏㺄㼶䃋䄖䜽䠼䤅䩱𱃞䵉俞偷偸兪匬喩喻堬媮崳嵛愈愉揄楡榆歈毹毺渝牏瑜瘉睮窬𦈕羭腧萮蝓褕觎谕貐踰输逾鄃𨱎隃𩨈𡩗𢔢𢾄𣂮𣈥𣈯𤚎𤭷𥠕𦖭𦩞𧱬𧼯𰿵𱄁𪃎𪉰𱋠𪎨𪹊𫥓𬰅𭵙𮄶,"[{'1611': {'same': ['输', '㡏', '䠼', '䩱', '毹', '毺', '腧', '鄃', '隃', '𧼯'], 'different': ['偷', '愉', '愈', '喻', '瑜', '谕', '逾', '渝', '榆', '觎', '俞', '揄', '㓱', '㢏', '㺄', '㼶', '䃋', '䄖', '䜽', '䤅', '𱃞', '䵉', '偸', '兪', '匬', '喩', '堬', '媮', '崳', '嵛', '楡', '歈', '牏', '瘉', '睮', '窬', '𦈕', '羭', '萮', '蝓', '褕', '貐', '踰', '𨱎', '𩨈', '𡩗', '𢔢', '𢾄', '𣂮', '𣈥', '𣈯', '𤚎', '𤭷', '𥠕', '𦖭', '𦩞', '𧱬', '𰿵', '𱄁', '𪃎', '𪉰', '𱋠', '𪎨', '𪹊', '𫥓', '𬰅', '𭵙', '𮄶']}}]",1611,输 㡏 䠼 䩱 毹 毺 腧 鄃 隃 𧼯,偷 愉 愈 喻 瑜 谕 逾 渝 榆 觎 俞 揄 㓱 㢏 㺄 㼶 䃋 䄖 䜽 䤅 𱃞 䵉 偸 兪 匬 喩 堬 媮 崳 嵛 楡 歈 牏 瘉 睮 窬 𦈕 羭 萮 蝓 褕 貐 踰 𨱎 𩨈 𡩗 𢔢 𢾄 𣂮 𣈥 𣈯 𤚎 𤭷 𥠕 𦖭 𦩞 𧱬 𰿵 𱄁 𪃎 𪉰 𱋠 𪎨 𪹊 𫥓 𬰅 𭵙 𮄶,10,68,0.1282051282051282,1611,输 㡏 䠼 䩱 毹 毺 腧 鄃 隃 𧼯,偷 愉 愈 喻 瑜 谕 逾 渝 榆 觎 俞 揄 㓱 㢏 㺄 㼶 䃋 䄖 䜽 䤅 𱃞 䵉 偸 兪 匬 喩 堬 媮 崳 嵛 楡 歈 牏 瘉 睮 窬 𦈕 羭 萮 蝓 褕 貐 踰 𨱎 𩨈 𡩗 𢔢 𢾄 𣂮 𣈥 𣈯 𤚎 𤭷 𥠕 𦖭 𦩞 𧱬 𰿵 𱄁 𪃎 𪉰 𱋠 𪎨 𪹊 𫥓 𬰅 𭵙 𮄶,10,68,0.1282051282051282
shua,['47'],㕞 刷涮,"[{'47': {'same': ['刷', '㕞'], 'different': ['涮']}}]",47,刷 㕞,涮,2,1,0.6666666666666666,47,刷 㕞,涮,2,1,0.6666666666666666
shuai,['1278'],㻭 䔞䢦摔率𫄴膟蟀𠌭𠞩𠻜𢕑𢟳𣘚𣼧𤗪𥡢𦆾𧗿𧜠𨄮𩘱𪅄𪖶,"[{'1278': {'same': ['摔', '蟀', '䢦', '𠌭', '𢕑', '𣘚', '𣼧', '𧗿', '𧜠', '𨄮', '𩘱'], 'different': ['率', '㻭', '䔞', '𫄴', '膟', '𠞩', '𠻜', '𢟳', '𤗪', '𥡢', '𦆾', '𪅄', '𪖶']}}]",1278,摔 蟀 䢦 𠌭 𢕑 𣘚 𣼧 𧗿 𧜠 𨄮 𩘱,率 㻭 䔞 𫄴 膟 𠞩 𠻜 𢟳 𤗪 𥡢 𦆾 𪅄 𪖶,11,13,0.4583333333333333,1278,摔 蟀 䢦 𠌭 𢕑 𣘚 𣼧 𧗿 𧜠 𨄮 𩘱,率 㻭 䔞 𫄴 膟 𠞩 𠻜 𢟳 𤗪 𥡢 𦆾 𪅄 𪖶,11,13,0.4583333333333333
shuan,['282'],㓌 㻇䀬佺全姾峑恮拴栓洤烇牷痊硂筌𬘥荃诠跧辁酫铨𩧴𠓾𠛮𠤹𠱴𡋄𢂘𦓰𧊲𧻤𨛈𨹑𪰡𫆂𫗐𫗽𫤪𬍟𮁵𮱶𮳁𰙾𰷄,"[{'282': {'same': ['拴', '栓'], 'different': ['全', '痊', '诠', '荃', '㓌', '㻇', '䀬', '佺', '姾', '峑', '恮', '洤', '烇', '牷', '硂', '筌', '𬘥', '跧', '辁', '酫', '铨', '𩧴', '𠓾', '𠛮', '𠤹', '𠱴', '𡋄', '𢂘', '𦓰', '𧊲', '𧻤', '𨛈', '𨹑', '𪰡', '𫆂', '𫗐', '𫗽', '𫤪', '𬍟', '𮁵', '𮱶', '𮳁', '𰙾', '𰷄']}}]",282,拴 栓,全 痊 诠 荃 㓌 㻇 䀬 佺 姾 峑 恮 洤 烇 牷 硂 筌 𬘥 跧 辁 酫 铨 𩧴 𠓾 𠛮 𠤹 𠱴 𡋄 𢂘 𦓰 𧊲 𧻤 𨛈 𨹑 𪰡 𫆂 𫗐 𫗽 𫤪 𬍟 𮁵 𮱶 𮳁 𰙾 𰷄,2,44,0.043478260869565216,282,拴 栓,全 痊 诠 荃 㓌 㻇 䀬 佺 姾 峑 恮 洤 烇 牷 硂 筌 𬘥 跧 辁 酫 铨 𩧴 𠓾 𠛮 𠤹 𠱴 𡋄 𢂘 𦓰 𧊲 𧻤 𨛈 𨹑 𪰡 𫆂 𫗐 𫗽 𫤪 𬍟 𮁵 𮱶 𮳁 𰙾 𰷄,2,44,0.043478260869565216
shuang,['1233'],㼽 䫪傸塽慡摤樉漺爽磢鏯𫘭𮭪𠓷𠗾𠞮𡻯𥡠𥱶𬘾𧴅,"[{'1233': {'same': ['爽', '䫪', '塽', '慡', '樉', '漺', '鏯', '𫘭', '𮭪', '𠗾', '𥡠', '𥱶', '𬘾', '𧴅'], 'different': ['㼽', '傸', '摤', '磢', '𠓷', '𠞮', '𡻯']}}]",1233,爽 䫪 塽 慡 樉 漺 鏯 𫘭 𮭪 𠗾 𥡠 𥱶 𬘾 𧴅,㼽 傸 摤 磢 𠓷 𠞮 𡻯,14,7,0.6666666666666666,1233,爽 䫪 塽 慡 樉 漺 鏯 𫘭 𮭪 𠗾 𥡠 𥱶 𬘾 𧴅,㼽 傸 摤 磢 𠓷 𠞮 𡻯,14,7,0.6666666666666666
shui,['1392'],兊 兑帨悦捝棁涗涚税脱蜕裞说锐阅𱅙,"[{'1392': {'same': ['税', '帨', '涗', '涚', '裞'], 'different': ['说', '脱', '悦', '阅', '锐', '兑', '蜕', '兊', '捝', '棁', '𱅙']}}]",1392,税 帨 涗 涚 裞,说 脱 悦 阅 锐 兑 蜕 兊 捝 棁 𱅙,5,11,0.3125,1392,税 帨 涗 涚 裞,说 脱 悦 阅 锐 兑 蜕 兊 捝 棁 𱅙,5,11,0.3125
shun,['1273'],瞬 舜蕣,"[{'1273': {'same': ['瞬', '舜', '蕣'], 'different': []}}]",1273,瞬 舜 蕣,,3,0,1.0,1273,瞬 舜 蕣,,3,0,1.0
shuo,['972'],𮰽 𮲃㧰䀥䑈𰷴䤕乐𪠸栎泺烁𬍛𰤕砾纅药𰴢跞轹铄鱳𠘙𡾒𣀝𣋵𧔉,"[{'972': {'same': ['烁', '铄', '䀥', '𣀝'], 'different': ['乐', '药', '砾', '栎', '𮰽', '𮲃', '㧰', '䑈', '𰷴', '䤕', '𪠸', '泺', '𬍛', '𰤕', '纅', '𰴢', '跞', '轹', '鱳', '𠘙', '𡾒', '𣋵', '𧔉']}}]",972,烁 铄 䀥 𣀝,乐 药 砾 栎 𮰽 𮲃 㧰 䑈 𰷴 䤕 𪠸 泺 𬍛 𰤕 纅 𰴢 跞 轹 鱳 𠘙 𡾒 𣋵 𧔉,4,23,0.14814814814814814,972,烁 铄 䀥 𣀝,乐 药 砾 栎 𮰽 𮲃 㧰 䑈 𰷴 䤕 𪠸 泺 𬍛 𰤕 纅 𰴢 跞 轹 鱳 𠘙 𡾒 𣋵 𧔉,4,23,0.14814814814814814
si,['1173'],㯕 㽄䔮䡳凘厮嘶撕斯澌燍簛𰾴𡡒𢠹𣚄𣤘𣩠𤺊𥐀𥕶𧝤𩅰𪆁𪆗𪖉,"[{'1173': {'same': ['斯', '撕', '厮', '嘶', '㽄', '䔮', '䡳', '凘', '澌', '燍', '𰾴', '𡡒', '𢠹', '𣚄', '𣩠', '𥐀', '𥕶', '𧝤', '𩅰', '𪆁', '𪆗', '𪖉'], 'different': ['㯕', '簛', '𣤘', '𤺊']}}]",1173,斯 撕 厮 嘶 㽄 䔮 䡳 凘 澌 燍 𰾴 𡡒 𢠹 𣚄 𣩠 𥐀 𥕶 𧝤 𩅰 𪆁 𪆗 𪖉,㯕 簛 𣤘 𤺊,22,4,0.8461538461538461,1173,斯 撕 厮 嘶 㽄 䔮 䡳 凘 澌 燍 𰾴 𡡒 𢠹 𣚄 𣩠 𥐀 𥕶 𧝤 𩅰 𪆁 𪆗 𪖉,㯕 簛 𣤘 𤺊,22,4,0.8461538461538461
song,['329'],𫩛 𭎂㜡𪨊㢔㹐𬎧䐫𰲯䙕䡮𨑹䰌䳷从𰁧𰎌𡵝怂𪭢暰枞𰛏熧𪻐疭𰥒磫𥬈纵耸苁𫎆踪𫓩𢐔𢓅𰑅𣯨𤡆𥡬𦌇𦗜𬟺𧺣𧿛𨄦𨲧𫕚𩀰𬲪𩞐𬷿𪖁𰟕,"[{'329': {'same': ['耸', '怂', '𪨊', '𰁧', '𰎌', '𬲪'], 'different': ['从', '踪', '纵', '枞', '𫩛', '𭎂', '㜡', '㢔', '㹐', '𬎧', '䐫', '𰲯', '䙕', '䡮', '𨑹', '䰌', '䳷', '𡵝', '𪭢', '暰', '𰛏', '熧', '𪻐', '疭', '𰥒', '磫', '𥬈', '苁', '𫎆', '𫓩', '𢐔', '𢓅', '𰑅', '𣯨', '𤡆', '𥡬', '𦌇', '𦗜', '𬟺', '𧺣', '𧿛', '𨄦', '𨲧', '𫕚', '𩀰', '𩞐', '𬷿', '𪖁', '𰟕']}}]",329,耸 怂 𪨊 𰁧 𰎌 𬲪,从 踪 纵 枞 𫩛 𭎂 㜡 㢔 㹐 𬎧 䐫 𰲯 䙕 䡮 𨑹 䰌 䳷 𡵝 𪭢 暰 𰛏 熧 𪻐 疭 𰥒 磫 𥬈 苁 𫎆 𫓩 𢐔 𢓅 𰑅 𣯨 𤡆 𥡬 𦌇 𦗜 𬟺 𧺣 𧿛 𨄦 𨲧 𫕚 𩀰 𩞐 𬷿 𪖁 𰟕,6,49,0.10909090909090909,329,耸 怂 𪨊 𰁧 𰎌 𬲪,从 踪 纵 枞 𫩛 𭎂 㜡 㢔 㹐 𬎧 䐫 𰲯 䙕 䡮 𨑹 䰌 䳷 𡵝 𪭢 暰 𰛏 熧 𪻐 疭 𰥒 磫 𥬈 苁 𫎆 𫓩 𢐔 𢓅 𰑅 𣯨 𤡆 𥡬 𦌇 𦗜 𬟺 𧺣 𧿛 𨄦 𨲧 𫕚 𩀰 𩞐 𬷿 𪖁 𰟕,6,49,0.10909090909090909
sou,['1143'],㟬 㥰㪢傁叟嗖嫂廋搜溲獀瘦瞍膄艘蓃螋𫍲遚鄋醙锼飕馊𩨄𠪇𣯜𤔣𥰞𧳶𧽏,"[{'1143': {'same': ['搜', '艘', '馊', '嗖', '叟', '飕', '廋', '㟬', '傁', '溲', '獀', '瞍', '蓃', '螋', '鄋', '醙', '锼', '𩨄', '𠪇', '𣯜', '𧳶', '𧽏'], 'different': ['瘦', '嫂', '㥰', '㪢', '膄', '𫍲', '遚', '𤔣', '𥰞']}}]",1143,搜 艘 馊 嗖 叟 飕 廋 㟬 傁 溲 獀 瞍 蓃 螋 鄋 醙 锼 𩨄 𠪇 𣯜 𧳶 𧽏,瘦 嫂 㥰 㪢 膄 𫍲 遚 𤔣 𥰞,22,9,0.7096774193548387,1143,搜 艘 馊 嗖 叟 飕 廋 㟬 傁 溲 獀 瞍 蓃 螋 鄋 醙 锼 𩨄 𠪇 𣯜 𧳶 𧽏,瘦 嫂 㥰 㪢 膄 𫍲 遚 𤔣 𥰞,22,9,0.7096774193548387
su,['1261'],㴋 啸𰗹𰙑箫粛绣肃萧蟰锈骕𱇿鹔𰬩,"[{'1261': {'same': ['肃', '㴋', '𰗹', '粛', '骕', '𱇿', '鹔'], 'different': ['锈', '箫', '绣', '萧', '啸', '𰙑', '蟰', '𰬩']}}]",1261,肃 㴋 𰗹 粛 骕 𱇿 鹔,锈 箫 绣 萧 啸 𰙑 蟰 𰬩,7,8,0.4666666666666667,1261,肃 㴋 𰗹 粛 骕 𱇿 鹔,锈 箫 绣 萧 啸 𰙑 蟰 𰬩,7,8,0.4666666666666667
suan,['313'],㕙 㛖㻐䘒䝜䞭俊傻儍唆埈夋峻悛捘晙朘梭浚焌狻畯痠皴睃稄竣羧脧荾𰵯賐踆逡酸𮸏陖馂骏𱇳𱉿𱉾黢,"[{'313': {'same': ['酸', '䝜', '狻', '痠'], 'different': ['傻', '俊', '梭', '唆', '峻', '骏', '晙', '逡', '竣', '皴', '黢', '悛', '浚', '㕙', '㛖', '㻐', '䘒', '䞭', '儍', '埈', '夋', '捘', '朘', '焌', '畯', '睃', '稄', '羧', '脧', '荾', '𰵯', '賐', '踆', '𮸏', '陖', '馂', '𱇳', '𱉿', '𱉾']}}]",313,酸 䝜 狻 痠,傻 俊 梭 唆 峻 骏 晙 逡 竣 皴 黢 悛 浚 㕙 㛖 㻐 䘒 䞭 儍 埈 夋 捘 朘 焌 畯 睃 稄 羧 脧 荾 𰵯 賐 踆 𮸏 陖 馂 𱇳 𱉿 𱉾,4,39,0.09302325581395349,313,酸 䝜 狻 痠,傻 俊 梭 唆 峻 骏 晙 逡 竣 皴 黢 悛 浚 㕙 㛖 㻐 䘒 䞭 儍 埈 夋 捘 朘 焌 畯 睃 稄 羧 脧 荾 𰵯 賐 踆 𮸏 陖 馂 𱇳 𱉿 𱉾,4,39,0.09302325581395349
sui,['1257A'],㸂 䍁𫟦嬘旞檖澻燧璲礈禭穟襚譢邃𬭼隧鿪𡀟𡑞𢅕𢢝𢷊𣄚𤻄𥴦𦼯𧁂𧸙𨆏𨣢𨷃𩍚𭛉𭿨𮄜𮕆𰖱𲂖𲌓,"[{'1257A': {'same': ['隧', '邃', '燧', '䍁', '𫟦', '嬘', '旞', '檖', '澻', '璲', '禭', '穟', '襚', '譢', '𬭼', '𡑞', '𢅕', '𤻄', '𥴦', '𧸙', '𨆏', '𨣢', '𨷃', '𩍚'], 'different': ['㸂', '礈', '鿪', '𡀟', '𢢝', '𢷊', '𣄚', '𦼯', '𧁂', '𭛉', '𭿨', '𮄜', '𮕆', '𰖱', '𲂖', '𲌓']}}]",1257A,隧 邃 燧 䍁 𫟦 嬘 旞 檖 澻 璲 禭 穟 襚 譢 𬭼 𡑞 𢅕 𤻄 𥴦 𧸙 𨆏 𨣢 𨷃 𩍚,㸂 礈 鿪 𡀟 𢢝 𢷊 𣄚 𦼯 𧁂 𭛉 𭿨 𮄜 𮕆 𰖱 𲂖 𲌓,24,16,0.6,1257A,隧 邃 燧 䍁 𫟦 嬘 旞 檖 澻 璲 禭 穟 襚 譢 𬭼 𡑞 𢅕 𤻄 𥴦 𧸙 𨆏 𨣢 𨷃 𩍚,㸂 礈 鿪 𡀟 𢢝 𢷊 𣄚 𦼯 𧁂 𭛉 𭿨 𮄜 𮕆 𰖱 𲂖 𲌓,24,16,0.6
sun,['1242'],孙 𰓧狲荪逊,"[{'1242': {'same': ['孙', '荪', '狲', '𰓧'], 'different': ['逊']}}]",1242,孙 荪 狲 𰓧,逊,4,1,0.8,1242,孙 荪 狲 𰓧,逊,4,1,0.8
suo,['313'],㕙 㛖㻐䘒䝜䞭俊傻儍唆埈夋峻悛捘晙朘梭浚焌狻畯痠皴睃稄竣羧脧荾𰵯賐踆逡酸𮸏陖馂骏𱇳𱉿𱉾黢,"[{'313': {'same': ['梭', '唆', '㛖', '睃', '羧', '𱇳'], 'different': ['傻', '酸', '俊', '峻', '骏', '晙', '逡', '竣', '皴', '黢', '悛', '浚', '㕙', '㻐', '䘒', '䝜', '䞭', '儍', '埈', '夋', '捘', '朘', '焌', '狻', '畯', '痠', '稄', '脧', '荾', '𰵯', '賐', '踆', '𮸏', '陖', '馂', '𱉿', '𱉾']}}]",313,梭 唆 㛖 睃 羧 𱇳,傻 酸 俊 峻 骏 晙 逡 竣 皴 黢 悛 浚 㕙 㻐 䘒 䝜 䞭 儍 埈 夋 捘 朘 焌 狻 畯 痠 稄 脧 荾 𰵯 賐 踆 𮸏 陖 馂 𱉿 𱉾,6,37,0.13953488372093023,313,梭 唆 㛖 睃 羧 𱇳,傻 酸 俊 峻 骏 晙 逡 竣 皴 黢 悛 浚 㕙 㻐 䘒 䝜 䞭 儍 埈 夋 捘 朘 焌 狻 畯 痠 稄 脧 荾 𰵯 賐 踆 𮸏 陖 馂 𱉿 𱉾,6,37,0.13953488372093023
ta,['1303'],㛥 㧺㭼㹺䂿䈋䍝䓠䵬䶁崉沓涾濌𰵸踏𰾓鞜𠉤𠴲𢃕𤿽𦧟𦧥𨌭𨓬𨡍𨵝𩎽𩣯𩭣𪂌,"[{'1303': {'same': ['踏', '沓', '鞜', '㛥', '㧺', '㭼', '㹺', '䂿', '䈋', '䍝', '䓠', '䵬', '䶁', '崉', '涾', '濌', '𰵸', '𰾓', '𠴲', '𢃕', '𤿽', '𦧟', '𦧥', '𨌭', '𨓬', '𨵝', '𩎽', '𪂌'], 'different': ['𠉤', '𨡍', '𩣯', '𩭣']}}]",1303,踏 沓 鞜 㛥 㧺 㭼 㹺 䂿 䈋 䍝 䓠 䵬 䶁 崉 涾 濌 𰵸 𰾓 𠴲 𢃕 𤿽 𦧟 𦧥 𨌭 𨓬 𨵝 𩎽 𪂌,𠉤 𨡍 𩣯 𩭣,28,4,0.875,1303,踏 沓 鞜 㛥 㧺 㭼 㹺 䂿 䈋 䍝 䓠 䵬 䶁 崉 涾 濌 𰵸 𰾓 𠴲 𢃕 𤿽 𦧟 𦧥 𨌭 𨓬 𨵝 𩎽 𪂌,𠉤 𨡍 𩣯 𩭣,28,4,0.875
tai,['1373'],㣍 佁冶台咍始怠怡抬枱枲殆殶治炱眙笞绐胎苔诒贻跆迨邰𬭀饴骀鲐𱌯𣗻,"[{'1373': {'same': ['台', '抬', '胎', '苔', '跆', '枱', '㣍', '炱', '邰', '鲐'], 'different': ['始', '治', '怡', '殆', '怠', '冶', '笞', '贻', '饴', '咍', '绐', '佁', '枲', '殶', '眙', '诒', '迨', '𬭀', '骀', '𱌯', '𣗻']}}]",1373,台 抬 胎 苔 跆 枱 㣍 炱 邰 鲐,始 治 怡 殆 怠 冶 笞 贻 饴 咍 绐 佁 枲 殶 眙 诒 迨 𬭀 骀 𱌯 𣗻,10,21,0.3225806451612903,1373,台 抬 胎 苔 跆 枱 㣍 炱 邰 鲐,始 治 怡 殆 怠 冶 笞 贻 饴 咍 绐 佁 枲 殶 眙 诒 迨 𬭀 骀 𱌯 𣗻,10,21,0.3225806451612903
tan,['1568'],㥕 㲜㷋䆦䊏䎦䗊倓剡啖埮婒惔扊掞敥晱棪欻毯氮淡炎烾焱煔燅琰痰睒𰬧腅舕菼裧𬊦谈赕郯醈锬𩖖𩙪𱃿𡨼𢃔𢉘𢻑𢽻𣨬𤈹𤊼𤟇𤯇𤲩𤾃𥟢𦋎𦖠𦧡𦩗𦫟𧣹𨁹𨌹𨤮𩗹𩩧𩸥𬸖𪉧𪏋𪑓𪺯𬫨𭻞𮥐𮪋𮫣𮭽,"[{'1568': {'same': ['谈', '毯', '痰', '㲜', '㷋', '䗊', '倓', '埮', '婒', '惔', '舕', '菼', '郯', '醈', '锬', '𩖖', '𱃿', '𧣹', '𪉧'], 'different': ['淡', '炎', '氮', '㥕', '䆦', '䊏', '䎦', '剡', '啖', '扊', '掞', '敥', '晱', '棪', '欻', '烾', '焱', '煔', '燅', '琰', '睒', '𰬧', '腅', '裧', '𬊦', '赕', '𩙪', '𡨼', '𢃔', '𢉘', '𢻑', '𢽻', '𣨬', '𤈹', '𤊼', '𤟇', '𤯇', '𤲩', '𤾃', '𥟢', '𦋎', '𦖠', '𦧡', '𦩗', '𦫟', '𨁹', '𨌹', '𨤮', '𩗹', '𩩧', '𩸥', '𬸖', '𪏋', '𪑓', '𪺯', '𬫨', '𭻞', '𮥐', '𮪋', '𮫣', '𮭽']}}]",1568,谈 毯 痰 㲜 㷋 䗊 倓 埮 婒 惔 舕 菼 郯 醈 锬 𩖖 𱃿 𧣹 𪉧,淡 炎 氮 㥕 䆦 䊏 䎦 剡 啖 扊 掞 敥 晱 棪 欻 烾 焱 煔 燅 琰 睒 𰬧 腅 裧 𬊦 赕 𩙪 𡨼 𢃔 𢉘 𢻑 𢽻 𣨬 𤈹 𤊼 𤟇 𤯇 𤲩 𤾃 𥟢 𦋎 𦖠 𦧡 𦩗 𦫟 𨁹 𨌹 𨤮 𩗹 𩩧 𩸥 𬸖 𪏋 𪑓 𪺯 𬫨 𭻞 𮥐 𮪋 𮫣 𮭽,19,61,0.2375,1568,谈 毯 痰 㲜 㷋 䗊 倓 埮 婒 惔 舕 菼 郯 醈 锬 𩖖 𱃿 𧣹 𪉧,淡 炎 氮 㥕 䆦 䊏 䎦 剡 啖 扊 掞 敥 晱 棪 欻 烾 焱 煔 燅 琰 睒 𰬧 腅 裧 𬊦 赕 𩙪 𡨼 𢃔 𢉘 𢻑 𢽻 𣨬 𤈹 𤊼 𤟇 𤯇 𤲩 𤾃 𥟢 𦋎 𦖠 𦧡 𦩗 𦫟 𨁹 𨌹 𨤮 𩗹 𩩧 𩸥 𬸖 𪏋 𪑓 𪺯 𬫨 𭻞 𮥐 𮪋 𮫣 𮭽,19,61,0.2375
tang,['1167'],㫾 㭻㲂䊑䟫䠀䣊倘党尝埫堂尙尚常当徜惝掌敞棠淌牚甞绱耥裳赏趟躺鋿𠶤𡞀𢉒𢮐𢻒𣎃𣮜𤙽𤷛𤿼𥓡𦫢𦰱𧩡𨌩𨜂𨿰𩗵𩜋𪁺𪽄𫙥𫨋𫻹𬓮𬕒𬡾𬴬𭝒𭯝𮞢𮨏𰕋𱑸𱿫𲈆𲋧,"[{'1167': {'same': ['堂', '躺', '趟', '淌', '倘', '棠', '㭻', '䠀', '埫', '耥', '𨌩', '𱿫'], 'different': ['当', '常', '尝', '掌', '尚', '赏', '党', '敞', '裳', '绱', '徜', '㫾', '㲂', '䊑', '䟫', '䣊', '尙', '惝', '牚', '甞', '鋿', '𠶤', '𡞀', '𢉒', '𢮐', '𢻒', '𣎃', '𣮜', '𤙽', '𤷛', '𤿼', '𥓡', '𦫢', '𦰱', '𧩡', '𨜂', '𨿰', '𩗵', '𩜋', '𪁺', '𪽄', '𫙥', '𫨋', '𫻹', '𬓮', '𬕒', '𬡾', '𬴬', '𭝒', '𭯝', '𮞢', '𮨏', '𰕋', '𱑸', '𲈆', '𲋧']}}]",1167,堂 躺 趟 淌 倘 棠 㭻 䠀 埫 耥 𨌩 𱿫,当 常 尝 掌 尚 赏 党 敞 裳 绱 徜 㫾 㲂 䊑 䟫 䣊 尙 惝 牚 甞 鋿 𠶤 𡞀 𢉒 𢮐 𢻒 𣎃 𣮜 𤙽 𤷛 𤿼 𥓡 𦫢 𦰱 𧩡 𨜂 𨿰 𩗵 𩜋 𪁺 𪽄 𫙥 𫨋 𫻹 𬓮 𬕒 𬡾 𬴬 𭝒 𭯝 𮞢 𮨏 𰕋 𱑸 𲈆 𲋧,12,56,0.17647058823529413,1167,堂 躺 趟 淌 倘 棠 㭻 䠀 埫 耥 𨌩 𱿫,当 常 尝 掌 尚 赏 党 敞 裳 绱 徜 㫾 㲂 䊑 䟫 䣊 尙 惝 牚 甞 鋿 𠶤 𡞀 𢉒 𢮐 𢻒 𣎃 𣮜 𤙽 𤷛 𤿼 𥓡 𦫢 𦰱 𧩡 𨜂 𨿰 𩗵 𩜋 𪁺 𪽄 𫙥 𫨋 𫻹 𬓮 𬕒 𬡾 𬴬 𭝒 𭯝 𮞢 𮨏 𰕋 𱑸 𲈆 𲋧,12,56,0.17647058823529413
tao,['1599'],㗖 䈱䤾䧟䵚嫍幍慆搯槄滔熖瑫稻𬘺舀蓞𰵽蹈𮷝鞱韬𬳊𠋯𠞞𡺫𤨐𥉰𦦌𱅣,"[{'1599': {'same': ['滔', '韬', '䈱', '䤾', '䵚', '嫍', '幍', '慆', '搯', '槄', '瑫', '𬘺', '𰵽', '𮷝', '鞱', '𬳊', '𠞞', '𡺫', '𱅣'], 'different': ['蹈', '稻', '舀', '㗖', '䧟', '熖', '蓞', '𠋯', '𤨐', '𥉰', '𦦌']}}]",1599,滔 韬 䈱 䤾 䵚 嫍 幍 慆 搯 槄 瑫 𬘺 𰵽 𮷝 鞱 𬳊 𠞞 𡺫 𱅣,蹈 稻 舀 㗖 䧟 熖 蓞 𠋯 𤨐 𥉰 𦦌,19,11,0.6333333333333333,1599,滔 韬 䈱 䤾 䵚 嫍 幍 慆 搯 槄 瑫 𬘺 𰵽 𮷝 鞱 𬳊 𠞞 𡺫 𱅣,蹈 稻 舀 㗖 䧟 熖 蓞 𠋯 𤨐 𥉰 𦦌,19,11,0.6333333333333333
te,"['1118', '1299']",㣺 伈吢吣心忄忐忑沁芯|,"[{'1118': {'same': ['忑'], 'different': ['心', '芯', '忐', '沁', '忄', '㣺', '伈', '吢', '吣']}}, {'1299': {'same': ['忑'], 'different': ['忐']}}]",1118,忑,心 芯 忐 沁 忄 㣺 伈 吢 吣,1,9,0.1,1299,忑,忐,1,1,0.5
teng,['1208'],胜 堘塍媵朕滕畻縢螣誊𬂉腾,"[{'1208': {'same': ['腾', '滕', '誊', '縢', '螣'], 'different': ['胜', '朕', '堘', '塍', '媵', '畻', '𬂉']}}]",1208,腾 滕 誊 縢 螣,胜 朕 堘 塍 媵 畻 𬂉,5,7,0.4166666666666667,1208,腾 滕 誊 縢 螣,胜 朕 堘 塍 媵 畻 𬂉,5,7,0.4166666666666667
ti,['1559'],㑥 㛫䯜剔埸惕惖掦敡易晹焬痬睗𰬣舓蜴裼赐踢逷锡鬄鯣鶍𠃓𠴭𡸑𣊷𣨟𤟍𥍴𥟘𥮬𦓻𨲎𩋌𪕩,"[{'1559': {'same': ['踢', '剔', '惕', '䯜', '惖', '掦', '裼', '逷', '𡸑', '𨲎', '𪕩'], 'different': ['易', '赐', '锡', '蜴', '埸', '㑥', '㛫', '敡', '晹', '焬', '痬', '睗', '𰬣', '舓', '鬄', '鯣', '鶍', '𠃓', '𠴭', '𣊷', '𣨟', '𤟍', '𥍴', '𥟘', '𥮬', '𦓻', '𩋌']}}]",1559,踢 剔 惕 䯜 惖 掦 裼 逷 𡸑 𨲎 𪕩,易 赐 锡 蜴 埸 㑥 㛫 敡 晹 焬 痬 睗 𰬣 舓 鬄 鯣 鶍 𠃓 𠴭 𣊷 𣨟 𤟍 𥍴 𥟘 𥮬 𦓻 𩋌,11,27,0.2894736842105263,1559,踢 剔 惕 䯜 惖 掦 裼 逷 𡸑 𨲎 𪕩,易 赐 锡 蜴 埸 㑥 㛫 敡 晹 焬 痬 睗 𰬣 舓 鬄 鯣 鶍 𠃓 𠴭 𣊷 𣨟 𤟍 𥍴 𥟘 𥮬 𦓻 𩋌,11,27,0.2894736842105263
tian,['63'],㐤 㒹㣀㥲䈯䐜𫟥傎厧嗔塡填嫃寘嵮愼慎搷槇槙滇瑱瘨眞真瞋磌禛稹窴缜蒖衠謓蹎鎭镇阗顚颠鬒鷆𱊚黰𱌺𠁒𡻗𦗀𦫭𧰊𧽍,"[{'63': {'same': ['填', '塡', '搷', '瑱', '磌', '窴', '阗', '鷆', '𱊚', '𦗀', '𧰊'], 'different': ['真', '镇', '颠', '慎', '缜', '嗔', '㐤', '㒹', '㣀', '㥲', '䈯', '䐜', '𫟥', '傎', '厧', '嫃', '寘', '嵮', '愼', '槇', '槙', '滇', '瘨', '眞', '瞋', '禛', '稹', '蒖', '衠', '謓', '蹎', '鎭', '顚', '鬒', '黰', '𱌺', '𠁒', '𡻗', '𦫭', '𧽍']}}]",63,填 塡 搷 瑱 磌 窴 阗 鷆 𱊚 𦗀 𧰊,真 镇 颠 慎 缜 嗔 㐤 㒹 㣀 㥲 䈯 䐜 𫟥 傎 厧 嫃 寘 嵮 愼 槇 槙 滇 瘨 眞 瞋 禛 稹 蒖 衠 謓 蹎 鎭 顚 鬒 黰 𱌺 𠁒 𡻗 𦫭 𧽍,11,40,0.21568627450980393,63,填 塡 搷 瑱 磌 窴 阗 鷆 𱊚 𦗀 𧰊,真 镇 颠 慎 缜 嗔 㐤 㒹 㣀 㥲 䈯 䐜 𫟥 傎 厧 嫃 寘 嵮 愼 槇 槙 滇 瘨 眞 瞋 禛 稹 蒖 衠 謓 蹎 鎭 顚 鬒 黰 𱌺 𠁒 𡻗 𦫭 𧽍,11,40,0.21568627450980393
tiao,['1221'],䄻 䠷佻兆咷垗姚恌挑旐晁桃洮珧眺祧窕筄脁𬢋𫍥跳迯逃铫鞉𫖯𱅏鼗,"[{'1221': {'same': ['跳', '挑', '窕', '佻', '眺', '䠷', '恌', '祧', '脁', '𬢋', '𫍥'], 'different': ['逃', '桃', '兆', '姚', '䄻', '咷', '垗', '旐', '晁', '洮', '珧', '筄', '迯', '铫', '鞉', '𫖯', '𱅏', '鼗']}}]",1221,跳 挑 窕 佻 眺 䠷 恌 祧 脁 𬢋 𫍥,逃 桃 兆 姚 䄻 咷 垗 旐 晁 洮 珧 筄 迯 铫 鞉 𫖯 𱅏 鼗,11,18,0.3793103448275862,1221,跳 挑 窕 佻 眺 䠷 恌 祧 脁 𬢋 𫍥,逃 桃 兆 姚 䄻 咷 垗 旐 晁 洮 珧 筄 迯 铫 鞉 𫖯 𱅏 鼗,11,18,0.3793103448275862
tie,['177'],㣌 㸃乩佔占呫坫帖店怗战拈敁毡沾点煔玷痁砧站粘苫觇贴跕鉆阽飐鲇黏𤘇,"[{'177': {'same': ['贴', '帖', '呫', '怗'], 'different': ['点', '站', '战', '店', '占', '粘', '沾', '黏', '玷', '毡', '拈', '砧', '苫', '鲇', '㣌', '㸃', '乩', '佔', '坫', '敁', '煔', '痁', '觇', '跕', '鉆', '阽', '飐', '𤘇']}}]",177,贴 帖 呫 怗,点 站 战 店 占 粘 沾 黏 玷 毡 拈 砧 苫 鲇 㣌 㸃 乩 佔 坫 敁 煔 痁 觇 跕 鉆 阽 飐 𤘇,4,28,0.125,177,贴 帖 呫 怗,点 站 战 店 占 粘 沾 黏 玷 毡 拈 砧 苫 鲇 㣌 㸃 乩 佔 坫 敁 煔 痁 觇 跕 鉆 阽 飐 𤘇,4,28,0.125
